{
  "schema_version": "1.0.0",
  "project": {
    "id": "project-slug",
    "name": "Project name",
    "repo_root": "/absolute/path/to/repository",
    "revision": "",
    "repository_kind": "unknown",
    "remote_url": null
  },
  "analysis_scope": {
    "start_date": null,
    "end_date": null,
    "starter_ref": null,
    "upstream_ref": null,
    "github_availability": "not-requested",
    "execution_policy": "ask-before-execute",
    "collected_at": "1970-01-01T00:00:00Z"
  },
  "identity": {
    "names": [],
    "emails": [],
    "github_handle": null,
    "status": "missing"
  },
  "evidence": [],
  "claims": [],
  "contributions": [],
  "metrics": [],
  "star": {
    "situation": [],
    "task": [],
    "action": [],
    "result": []
  },
  "open_questions": [],
  "interview_topics": [],
  "execution_log": []
}
